{
  "$schema": "https://json-schema.org/draft/2020-12/schema",
  "$id": "https://raw.githubusercontent.com/FSD-CLI/cli/main/schema/fsd.config.schema.json",
  "title": "FSD CLI project configuration",
  "type": "object",
  "additionalProperties": false,
  "required": [
    "schemaVersion",
    "framework",
    "packageManager",
    "apiClient",
    "serverState",
    "clientState",
    "forms",
    "ui"
  ],
  "properties": {
    "$schema": { "type": "string" },
    "schemaVersion": { "const": 1 },
    "framework": { "enum": ["react-vite", "nextjs", "vue-vite", "nuxt", "sveltekit", "angular"] },
    "packageManager": { "enum": ["npm", "pnpm", "yarn", "bun"] },
    "apiClient": { "enum": ["axios", "fetch", "angular-http"] },
    "serverState": { "enum": ["react-query", "vue-query", "svelte-query", "none", "angular-query"] },
    "clientState": { "enum": ["zustand", "redux", "pinia", "svelte-store", "none", "ngrx-signals"] },
    "forms": { "enum": ["react-hook-form-zod", "vee-validate-zod", "sveltekit-superforms-zod", "none", "angular-forms-zod"] },
    "ui": { "const": "shared-ui" }
  }
}
